ID,Summary,Severity,CVSS_Score,CVE_Aliases,CWE_IDs,Ecosystem,Package_Name,Version_Introduced,Version_Fixed,Published,Modified
GHSA-5qw5-wf2q-f538,ActiveRecord-JDBC-Adapter (AR-JDBC) lib/arjdbc/jdbc/adapter.rb sql.gsub() Function SQL Injection,HIGH,CVSS:4.0/AV:N/AC:L/AT:N/PR:N/UI:N/VC:H/VI:H/VA:N/SC:N/SI:N/SA:N/E:P,,CWE-89,RubyGems,activerecord-jdbc-adapter,0,1.2.8,2026-01-16T19:20:40Z,2026-01-21T16:35:36Z
GHSA-5r2g-vphf-m5xc,Apache StreamPipes has Improper Privilege Management issue,MODERATE,CVSS:4.0/AV:N/AC:L/AT:N/PR:L/UI:N/VC:N/VI:H/VA:N/SC:N/SI:N/SA:N/E:U,CVE-2025-47411,CWE-269,Maven,org.apache.streampipes:streampipes-parent,0.69.0,0.98.0,2026-01-01T18:30:27Z,2026-01-02T16:29:40Z
GHSA-5rfx-cp42-p624,Quarkus REST has potential worker thread starvation when HTTP connection is closed while waiting to write,MODERATE,CVSS:3.1/AV:N/AC:H/PR:N/UI:N/S:U/C:N/I:N/A:H,CVE-2025-66560,CWE-770,Maven,io.quarkus:quarkus-rest,0,3.20.5,2026-01-07T18:09:56Z,2026-01-07T20:37:40Z
GHSA-5vx3-wx4q-6cj8,ImageMagick has a NULL pointer dereference in MSL parser via <comment> tag before image load,MODERATE,CVSS:3.1/AV:N/AC:L/PR:L/UI:N/S:U/C:N/I:N/A:H,CVE-2026-23952,CWE-476,NuGet,Magick.NET-Q8-x64,0,14.10.2,2026-01-21T01:06:51Z,2026-01-21T01:06:51Z
GHSA-5w5r-mf82-595p,Cap'n Proto has Undefined Behavior in constant::Reader and StructSchema,CRITICAL,CVSS:4.0/AV:N/AC:L/AT:N/PR:N/UI:N/VC:H/VI:H/VA:H/SC:N/SI:N/SA:N,,CWE-758,crates.io,capnp,0,0.24.0,2026-01-28T16:06:09Z,2026-01-28T16:06:09Z
GHSA-5x2r-hc65-25f9,ML-DSA Signature Verification Accepts Signatures with Repeated Hint Indices,MODERATE,CVSS:3.1/AV:N/AC:L/PR:N/UI:N/S:U/C:N/I:L/A:N,CVE-2026-24850,CWE-347,crates.io,ml-dsa,0.0.4,0.1.0-rc.4,2026-01-28T16:44:47Z,2026-01-28T16:44:47Z
GHSA-5xrp-6693-jjx9,n8n Unsafe Workflow Expression Evaluation Allows Remote Code Execution,CRITICAL,CVSS:3.1/AV:N/AC:L/PR:L/UI:N/S:C/C:H/I:H/A:H,CVE-2026-1470,CWE-95,npm,n8n,0,1.123.17,2026-01-27T15:30:32Z,2026-01-29T15:02:29Z
GHSA-637h-ch24-xp9m,XWiki Full Calendar Macro vulnerable to data leak through Calendar.JSONService,MODERATE,CVSS:3.1/AV:N/AC:L/PR:N/UI:N/S:U/C:L/I:N/A:N,CVE-2025-65090,CWE-200,Maven,org.xwiki.contrib:macro-fullcalendar-pom,0,2.4.6,2026-01-09T18:35:57Z,2026-01-11T14:55:42Z
GHSA-63cw-57p8-fm3p,PyTorch Vulnerable to Remote Code Execution via Untrusted Checkpoint Files,HIGH,CVSS:3.1/AV:N/AC:L/PR:N/UI:R/S:U/C:H/I:H/A:H,CVE-2026-24747,CWE-502; CWE-94,PyPI,pytorch,0,2.10.0,2026-01-27T20:10:54Z,2026-01-29T03:42:52Z
GHSA-63m5-974w-448v,Fleet has a JWT signature bypass vulnerability in Azure AD MDM enrollment ,CRITICAL,CVSS:4.0/AV:N/AC:L/AT:N/PR:N/UI:N/VC:H/VI:H/VA:H/SC:N/SI:N/SA:N,CVE-2026-23518,CWE-347,Go,github.com/fleetdm/fleet,4.78.0,4.78.3,2026-01-20T20:55:17Z,2026-02-27T22:02:58Z
GHSA-63v5-26vq-m4vm,Keycloak's missing timestamp validation allows attackers to extend SAML response validity periods,LOW,CVSS:3.1/AV:N/AC:H/PR:N/UI:R/S:U/C:N/I:L/A:N,CVE-2026-1190,CWE-112; CWE-347; CWE-613,Maven,org.keycloak:keycloak-services,0,,2026-01-26T21:30:36Z,2026-03-06T00:31:28Z
GHSA-63vm-454h-vhhq,pyasn1 has a DoS vulnerability in decoder,HIGH,CVSS:3.1/AV:N/AC:L/PR:N/UI:N/S:U/C:N/I:N/A:H,CVE-2026-23490,CWE-400; CWE-770,PyPI,pyasn1,0.6.1,0.6.2,2026-01-16T19:19:25Z,2026-02-01T18:30:16Z
GHSA-6475-r3vj-m8vf,AWS SDK for JavaScript v3 adopted defense in depth enhancement for region parameter value,LOW,CVSS:3.1/AV:N/AC:H/PR:N/UI:N/S:U/C:L/I:N/A:N,,CWE-20,npm,@smithy/config-resolver,0,4.4.0,2026-01-08T21:52:45Z,2026-01-08T21:52:45Z
GHSA-6497-prx7-gpmq,geopandas SQL Injection Vulnerability in to_postgis() Allows Information Disclosure,HIGH,CVSS:3.1/AV:N/AC:L/PR:N/UI:N/S:C/C:H/I:N/A:N,CVE-2025-69662,CWE-202; CWE-89,PyPI,geopandas,0,1.1.2,2026-01-30T21:30:22Z,2026-02-01T18:09:10Z
GHSA-657c-wxg6-jmqv,pH7-Social-Dating-CMS affected by a stored cross-site scripting (XSS) vulnerability,MODERATE,CVSS:3.1/AV:N/AC:L/PR:N/UI:R/S:C/C:L/I:L/A:N,CVE-2025-63644,CWE-79,Packagist,ph7software/ph7builder,0,,2026-01-14T18:31:37Z,2026-01-22T18:04:53Z
GHSA-66fc-rw6m-c2q6,Seroval affected by Denial of Service via Array serialization,HIGH,CVSS:3.1/AV:N/AC:L/PR:N/UI:N/S:U/C:N/I:N/A:H,CVE-2026-23957,CWE-770,npm,seroval,0,1.4.1,2026-01-21T17:05:54Z,2026-01-22T15:44:01Z
GHSA-6738-r8g5-qwp3,svelte vulnerable to Cross-site Scripting,MODERATE,CVSS:4.0/AV:N/AC:L/AT:N/PR:N/UI:P/VC:N/VI:N/VA:N/SC:L/SI:L/SA:N,CVE-2025-15265,CWE-79,npm,svelte,5.46.0,5.46.4,2026-01-15T20:13:33Z,2026-01-15T22:34:22Z
GHSA-67rj-pjg6-pq59,Jervis Has a SHA-256 Hex String Padding Bug,HIGH,CVSS:3.1/AV:N/AC:L/PR:N/UI:N/S:U/C:N/I:H/A:N,CVE-2025-68702,CWE-327,Maven,net.gleske:jervis,0,2.2,2026-01-13T14:52:31Z,2026-01-21T16:21:29Z
GHSA-69f9-5gxw-wvc2,AIOHTTP's unicode processing of header values could cause parsing discrepancies,LOW,CVSS:4.0/AV:N/AC:L/AT:N/PR:N/UI:N/VC:N/VI:L/VA:N/SC:N/SI:N/SA:N/E:U,CVE-2025-69224,CWE-444,PyPI,aiohttp,0,3.13.3,2026-01-05T22:58:57Z,2026-01-06T16:06:40Z
GHSA-6c46-p6j5-3f49,TYPO3 CMS Allows Broken Access Control in Redirects Module,MODERATE,CVSS:4.0/AV:N/AC:L/AT:N/PR:L/UI:N/VC:L/VI:L/VA:L/SC:N/SI:N/SA:N,CVE-2025-59021,CWE-862,Packagist,typo3/cms-redirects,14.0.0,14.0.2,2026-01-13T20:37:37Z,2026-01-13T20:37:37Z
GHSA-6c59-mwgh-r2x6,JSONPath vulnerable to Prototype Pollution due to insufficient input validation of object keys in lib/index.js,MODERATE,CVSS:4.0/AV:N/AC:L/AT:N/PR:N/UI:N/VC:N/VI:H/VA:N/SC:N/SI:N/SA:N/E:U,CVE-2025-61140,CWE-1321,npm,jsonpath,0,1.2.0,2026-01-28T18:30:47Z,2026-02-05T16:14:30Z
GHSA-6f65-4fv2-wwch,Vendure vulnerable to timing attack that enables user enumeration in NativeAuthenticationStrategy,LOW,CVSS:4.0/AV:N/AC:L/AT:N/PR:N/UI:N/VC:L/VI:N/VA:N/SC:N/SI:N/SA:N/E:U,CVE-2026-25050,CWE-202,npm,@vendure/core,0,3.5.3,2026-01-30T19:35:40Z,2026-01-30T19:35:40Z
GHSA-6fg3-hvw7-2fwq,Microsoft Playwright MCP Server vulnerable to DNS Rebinding Attack; Allows Attackers Access to All Server Tools,HIGH,CVSS:4.0/AV:N/AC:L/AT:N/PR:N/UI:P/VC:L/VI:L/VA:H/SC:L/SI:L/SA:L,CVE-2025-9611,CWE-749,npm,@playwright/mcp,0,0.0.40,2026-01-07T12:31:25Z,2026-01-07T20:02:55Z
GHSA-6g8q-hp2j-gvwv,Harvest May Expose OS Default SSH Login Password Via SUSE Virtualization Interactive Installer,CRITICAL,CVSS:3.1/AV:N/AC:L/PR:N/UI:N/S:U/C:H/I:H/A:H,CVE-2025-62877,CWE-1188,Go,github.com/harvester/harvester-installer,1.6.0,,2026-01-05T20:25:53Z,2026-01-08T21:18:48Z
GHSA-6h7w-v2xr-mqvw,Bagisto Missing Authentication on Installer API Endpoints,HIGH,CVSS:3.1/AV:N/AC:L/PR:N/UI:N/S:U/C:H/I:H/A:H,CVE-2026-21446,CWE-306,Packagist,bagisto/bagisto,2.3.0,2.3.10,2026-01-02T21:14:06Z,2026-01-08T21:35:01Z
GHSA-6jhg-hg63-jvvf,AIOHTTP vulnerable to  denial of service through large payloads,MODERATE,CVSS:4.0/AV:N/AC:L/AT:N/PR:N/UI:N/VC:N/VI:N/VA:H/SC:N/SI:N/SA:N/E:U,CVE-2025-69228,CWE-770,PyPI,aiohttp,0,3.13.3,2026-01-05T23:13:14Z,2026-01-06T16:06:55Z
GHSA-6jm8-x3g6-r33j,Soft Serve is missing an authorization check in LFS lock deletion,MODERATE,CVSS:3.1/AV:N/AC:L/PR:L/UI:N/S:U/C:N/I:L/A:L,CVE-2026-22253,CWE-863,Go,github.com/charmbracelet/soft-serve,0,0.11.2,2026-01-08T21:01:54Z,2026-01-08T21:37:08Z
GHSA-6jxm-fv7w-rw5j,Mailpit has a Server-Side Request Forgery (SSRF) via HTML Check API,MODERATE,CVSS:3.1/AV:N/AC:L/PR:N/UI:N/S:C/C:L/I:N/A:N,CVE-2026-23845,CWE-918,Go,github.com/axllent/mailpit,0,1.28.3,2026-01-21T01:01:26Z,2026-02-02T14:50:55Z
GHSA-6mq8-rvhq-8wgg,AIOHTTP's HTTP Parser auto_decompress feature is vulnerable to zip bomb,HIGH,CVSS:3.1/AV:N/AC:L/PR:N/UI:N/S:U/C:N/I:N/A:H,CVE-2025-69223,CWE-409; CWE-770,PyPI,aiohttp,0,3.13.3,2026-01-05T22:58:41Z,2026-01-06T16:06:18Z
GHSA-6mw6-mj76-grwc,gix-date can create non-utf8 string with `TimeBuf::as_str`,MODERATE,CVSS:4.0/AV:L/AC:L/AT:N/PR:N/UI:N/VC:N/VI:H/VA:H/SC:N/SI:N/SA:N/E:P,CVE-2026-0810,CWE-787,crates.io,gix-date,0,0.12.0,2026-01-05T19:43:29Z,2026-01-27T22:23:11Z
GHSA-6p6h-rqr6-62mv,GI-DocGen vulnerable to Reflected XSS via unescaped query strings,MODERATE,CVSS:3.1/AV:N/AC:L/PR:N/UI:R/S:C/C:L/I:L/A:N,CVE-2025-11687,CWE-79,PyPI,gi-docgen,0,2025.5,2026-01-26T21:30:36Z,2026-01-27T21:04:10Z
GHSA-6pfh-p556-v868,pnpm: Binary ZIP extraction allows arbitrary file write via path traversal (Zip Slip),MODERATE,CVSS:3.1/AV:N/AC:L/PR:N/UI:R/S:U/C:N/I:H/A:N,CVE-2026-23888,CWE-22; CWE-23; CWE-426,npm,pnpm,0,10.28.1,2026-01-26T21:02:49Z,2026-01-28T16:18:11Z
GHSA-6pw3-h7xf-x4gp,BlackSheep's ClientSession is vulnerable to CRLF injection,MODERATE,CVSS:4.0/AV:N/AC:L/AT:P/PR:N/UI:N/VC:N/VI:N/VA:N/SC:L/SI:L/SA:N,CVE-2026-22779,CWE-113; CWE-93,PyPI,blacksheep,0,2.4.6,2026-01-14T16:52:53Z,2026-01-14T19:50:38Z
GHSA-6r62-w2q3-48hf,BentoML has a Path Traversal via Bentofile Configuration,HIGH,CVSS:3.1/AV:N/AC:L/PR:N/UI:R/S:C/C:H/I:N/A:N,CVE-2026-24123,CWE-22,PyPI,bentoml,0,1.4.34,2026-01-26T21:17:16Z,2026-01-29T03:23:35Z
GHSA-6rcw-ww3x-xqwm,carbone Code Injection vulnerability,LOW,CVSS:3.1/AV:N/AC:H/PR:L/UI:N/S:U/C:L/I:L/A:L,CVE-2024-14020,CWE-94,npm,carbone,0,3.5.6,2026-01-07T12:31:19Z,2026-01-07T19:30:26Z
GHSA-6vfr-p2hx-6v32,Apache Linkis: Password Exposure,MODERATE,CVSS:3.1/AV:N/AC:L/PR:L/UI:N/S:U/C:H/I:N/A:N,CVE-2025-59355,CWE-532,Maven,org.apache.linkis:linkis-metadata,1.0.0,1.8.0,2026-01-19T09:30:28Z,2026-01-21T01:03:28Z
GHSA-6wqw-2p9w-4vw4,"Hono cache middleware ignores ""Cache-Control: private"" leading to Web Cache Deception",MODERATE,CVSS:3.1/AV:N/AC:L/PR:N/UI:N/S:U/C:L/I:N/A:N,CVE-2026-24472,CWE-524; CWE-613,npm,hono,0,4.11.7,2026-01-27T19:04:17Z,2026-01-29T03:39:36Z
GHSA-6x96-7vc8-cm3p,pnpm has Windows-specific tarball Path Traversal,MODERATE,CVSS:3.1/AV:N/AC:L/PR:N/UI:R/S:U/C:N/I:H/A:N,CVE-2026-23889,CWE-22,npm,pnpm,0,10.28.1,2026-01-26T21:02:44Z,2026-01-29T03:23:02Z
GHSA-73jg-4qh6-3f4g,Beam Exposes sensitive information via joinCleanPath function,MODERATE,CVSS:3.1/AV:L/AC:L/PR:H/UI:N/S:U/C:H/I:H/A:N,CVE-2025-69820,CWE-22,Go,github.com/beam-cloud/beta9,0,,2026-01-22T18:30:31Z,2026-01-29T22:58:34Z
GHSA-73rr-hh4g-fpgx,jsdiff has a Denial of Service vulnerability in parsePatch and applyPatch,LOW,CVSS:4.0/AV:N/AC:L/AT:N/PR:N/UI:N/VC:N/VI:N/VA:L/SC:N/SI:N/SA:N/E:U,CVE-2026-24001,CWE-1333; CWE-400,npm,diff,6.0.0,8.0.3,2026-01-14T21:34:12Z,2026-01-30T17:13:35Z
GHSA-742x-x762-7383,Craft CMS vulnerable to potential authenticated Remote Code Execution via Twig SSTI,MODERATE,CVSS:4.0/AV:N/AC:L/AT:P/PR:L/UI:N/VC:H/VI:H/VA:H/SC:N/SI:N/SA:N/E:U,CVE-2025-68454,CWE-1336,Packagist,craftcms/cms,5.0.0-RC1,5.8.21,2026-01-05T18:10:56Z,2026-01-06T15:52:15Z
GHSA-77p9-w6pj-rmvg,Apache Continuum vulnerable to Command Injection through Installations REST API,CRITICAL,CVSS:3.1/AV:N/AC:L/PR:L/UI:N/S:C/C:H/I:H/A:H,CVE-2016-15057,CWE-77,Maven,org.apache.continuum:continuum,0,,2026-01-26T12:30:29Z,2026-01-26T23:45:16Z
GHSA-77v3-r3jw-j2v2,External Secrets Operator insecurely retrieves secrets through the getSecretKey templating function,CRITICAL,CVSS:4.0/AV:L/AC:L/AT:N/PR:L/UI:N/VC:H/VI:H/VA:H/SC:H/SI:H/SA:H,CVE-2026-22822,CWE-863,Go,github.com/external-secrets/external-secrets,0.20.2,1.2.0,2026-01-20T16:37:18Z,2026-01-22T15:38:48Z
GHSA-77w2-v593-vxvv,Salt junos Module Vulnerable to Code Injection via Specially Crafted YAML Payload,HIGH,CVSS:3.1/AV:L/AC:L/PR:L/UI:N/S:U/C:H/I:H/A:H,CVE-2025-62348,CWE-94,PyPI,salt,0,3006.17,2026-01-30T21:30:22Z,2026-02-01T18:07:48Z
GHSA-78h3-63c4-5fqc,WeKnora has Command Injection in MCP stdio test,CRITICAL,CVSS:3.1/AV:N/AC:L/PR:L/UI:N/S:C/C:H/I:H/A:H,CVE-2026-22688,CWE-77,Go,github.com/Tencent/WeKnora,0,0.2.5,2026-01-09T19:21:22Z,2026-01-22T16:29:34Z
GHSA-78p6-6878-8mj6,SM2-PKE has Unchecked AffinePoint Decoding (unwrap) in decrypt(),HIGH,CVSS:3.1/AV:N/AC:L/PR:N/UI:N/S:U/C:N/I:N/A:H,CVE-2026-22699,CWE-20,crates.io,sm2,0.14.0-pre.0,,2026-01-09T22:35:35Z,2026-01-11T14:56:39Z
GHSA-793v-589g-574v,Bokeh server applications have Incomplete Origin Validation in WebSockets,MODERATE,CVSS:4.0/AV:N/AC:L/AT:P/PR:N/UI:A/VC:H/VI:H/VA:N/SC:N/SI:N/SA:N/E:U,CVE-2026-21883,CWE-1385,PyPI,bokeh,0,3.8.2,2026-01-06T17:53:44Z,2026-01-23T16:39:04Z
GHSA-796p-j2gh-9m2q,dcap-qvl has Missing Verification for QE Identity,CRITICAL,CVSS:4.0/AV:N/AC:L/AT:N/PR:N/UI:N/VC:H/VI:H/VA:N/SC:N/SI:N/SA:N,CVE-2026-22696,CWE-295; CWE-347,crates.io,dcap-qvl,0,0.3.9,2026-01-26T18:55:13Z,2026-01-29T03:22:29Z
GHSA-7c2f-r6gc-h92h,Apache Airflow proxy credentials for various providers might leak in task logs,HIGH,CVSS:3.1/AV:N/AC:L/PR:N/UI:N/S:U/C:H/I:N/A:N,CVE-2025-68675,CWE-532,PyPI,apache-airflow,3.0.0b1,3.1.6,2026-01-16T12:30:25Z,2026-02-24T16:21:08Z
GHSA-7cw6-7h3h-v8pf,Shopware Has Improper Control of Generation of Code in Twig rendered views,HIGH,CVSS:3.1/AV:N/AC:L/PR:H/UI:N/S:U/C:H/I:H/A:H,CVE-2026-23498,CWE-94,Packagist,shopware/shopware,6.7.0.0,6.7.6.1,2026-01-14T16:54:27Z,2026-01-14T21:46:46Z
GHSA-7f67-crqm-jgh7,Incus container image templating arbitrary host file read and write,HIGH,CVSS:3.1/AV:A/AC:L/PR:L/UI:N/S:C/C:H/I:H/A:N,CVE-2026-23954,CWE-22,Go,github.com/lxc/incus/v6/cmd/incusd,6.1.0,,2026-01-22T20:26:10Z,2026-01-23T15:46:34Z
GHSA-7f7m-83r3-p644,MineAdmin May Expose Sensitive Information to an Unauthorized Actor,MODERATE,CVSS:3.1/AV:N/AC:L/PR:N/UI:N/S:U/C:L/I:N/A:N,CVE-2026-1194,CWE-200,Packagist,mineadmin/mineadmin,1.0.0,,2026-01-20T00:30:27Z,2026-02-05T22:00:45Z
GHSA-7gcm-g887-7qv7,protobuf affected by a JSON recursion depth bypass,HIGH,CVSS:4.0/AV:N/AC:L/AT:P/PR:N/UI:N/VC:N/VI:N/VA:H/SC:N/SI:N/SA:L,CVE-2026-0994,CWE-674,PyPI,protobuf,6.30.0rc1,6.33.5,2026-01-23T15:31:35Z,2026-02-05T15:47:43Z
GHSA-7grm-h62g-5m97,NiceGUI is vulnerable to XSS via Unescaped URL in ui.navigate.history.push() / replace(),MODERATE,CVSS:3.1/AV:N/AC:L/PR:N/UI:R/S:C/C:L/I:L/A:N,CVE-2026-21871,CWE-79,PyPI,nicegui,2.13.0,3.5.0,2026-01-08T20:00:29Z,2026-01-08T20:00:29Z
GHSA-7jc7-g598-2p64,XDocReport affected by an XML External Entity (XXE) vulnerability,CRITICAL,CVSS:3.1/AV:N/AC:L/PR:N/UI:N/S:U/C:H/I:H/A:H,CVE-2025-65482,CWE-611,Maven,fr.opensagres.xdocreport:fr.opensagres.xdocreport.document,0.9.2,2.0.4,2026-01-20T18:31:57Z,2026-01-21T16:56:55Z
GHSA-7jxj-rpx7-ph2c,Umbraco.Forms CDN may cache sensitive form uploads when processed by ImageSharp,LOW,CVSS:3.1/AV:N/AC:H/PR:N/UI:R/S:U/C:L/I:N/A:N,,CWE-524,NuGet,Umbraco.Forms,0,13.9.0,2026-01-22T18:06:01Z,2026-01-22T18:06:01Z
GHSA-7p9h-m7m8-vhhv,phpMyFAQ: Attachment download allowed without dlattachment right (broken access control),MODERATE,CVSS:3.1/AV:N/AC:L/PR:L/UI:N/S:U/C:H/I:N/A:N,CVE-2026-24420,CWE-284,Packagist,phpmyfaq/phpmyfaq,0,4.0.17,2026-01-23T20:17:16Z,2026-01-28T04:43:20Z
GHSA-7qm7-455j-5p63,enclave-vm Vulnerable to Sandbox Escape via Host Error Prototype Chain,CRITICAL,CVSS:3.1/AV:N/AC:L/PR:N/UI:N/S:C/C:H/I:H/A:H,CVE-2026-22686,CWE-94,npm,enclave-vm,0,2.7.0,2026-01-14T16:52:30Z,2026-01-15T17:46:45Z
GHSA-7rqc-ff8m-7j23,Signal K Server Vulnerable to Denial of Service via Unrestricted Access Request Flooding,HIGH,CVSS:3.1/AV:N/AC:L/PR:N/UI:N/S:U/C:N/I:N/A:H,CVE-2025-68272,CWE-400; CWE-770,npm,signalk-server,0,2.19.0,2026-01-02T15:20:05Z,2026-01-02T15:20:05Z
GHSA-7vhp-vf5g-r2fw,pnpm Has Lockfile Integrity Bypass that Allows Remote Dynamic Dependencies,HIGH,CVSS:3.1/AV:N/AC:H/PR:N/UI:R/S:U/C:H/I:H/A:H,CVE-2025-69263,CWE-494,npm,pnpm,0,10.26.0,2026-01-07T19:06:59Z,2026-01-08T20:05:32Z
GHSA-7vp9-x248-9vr9,TYPO3 CMS Allows Insecure Deserialization via Mailer File Spool,MODERATE,CVSS:4.0/AV:L/AC:L/AT:P/PR:L/UI:N/VC:N/VI:L/VA:N/SC:H/SI:H/SA:H,CVE-2026-0859,CWE-502,Packagist,typo3/cms-core,14.0.0,14.0.2,2026-01-13T21:54:06Z,2026-01-13T21:54:06Z
GHSA-7vw6-5q2f-7w5r, Keycloak’s OpenID Connect Dynamic Client Registration feature affected by Server-Side Request Forgery (SSRF),MODERATE,CVSS:3.1/AV:N/AC:L/PR:N/UI:N/S:C/C:L/I:N/A:N,CVE-2026-1180,CWE-918,Maven,org.keycloak:keycloak-adapter-core,0,,2026-01-20T15:33:12Z,2026-01-21T21:55:11Z
GHSA-7wwv-79xw-rvvg,Vaadin vulnerable to Cross-site Scripting,MODERATE,CVSS:4.0/AV:N/AC:L/AT:N/PR:L/UI:A/VC:N/VI:N/VA:N/SC:L/SI:L/SA:N,CVE-2025-15022,CWE-79,Maven,com.vaadin:vaadin-server,7.0.0,7.7.50,2026-01-05T09:30:19Z,2026-01-05T19:48:50Z
GHSA-7x99-8x99-xc54,Salesforce Uni2TS has a Code Injection vulnerability,CRITICAL,CVSS:3.1/AV:N/AC:L/PR:N/UI:N/S:U/C:H/I:H/A:H,CVE-2026-22584,CWE-94,PyPI,uni2ts,0,2.0.0,2026-01-10T00:30:30Z,2026-01-21T21:17:51Z
GHSA-824x-88xg-cwrv,Redaxo has Path Traversal in Backup Addon Leading to Arbitrary File Read,HIGH,CVSS:4.0/AV:N/AC:L/AT:N/PR:H/UI:N/VC:H/VI:N/VA:N/SC:H/SI:H/SA:N,CVE-2026-21857,CWE-22; CWE-24,Packagist,redaxo/source,0,5.20.2,2026-01-05T20:02:58Z,2026-01-08T20:07:42Z
GHSA-829q-m3qg-ph8r,Vega XSS via expression abusing vlSelectionTuples function array map calls in environments with satisfactory function gadgets in the global scope,HIGH,CVSS:3.1/AV:N/AC:L/PR:N/UI:R/S:U/C:H/I:H/A:N,CVE-2025-65110,CWE-79,npm,vega-selections,0,5.6.3,2026-01-05T22:56:59Z,2026-01-06T15:51:50Z
GHSA-83fc-fqcc-2hmg,React Server Components have multiple Denial of Service Vulnerabilities,HIGH,CVSS:3.1/AV:N/AC:L/PR:N/UI:N/S:U/C:N/I:N/A:H,CVE-2026-23864,CWE-400,npm,react-server-dom-parcel,19.0.0,19.0.4,2026-01-29T15:00:30Z,2026-01-29T15:00:30Z
GHSA-846p-jg2w-w324,go-tuf affected by client DoS via malformed server response,MODERATE,CVSS:3.1/AV:N/AC:H/PR:N/UI:N/S:U/C:N/I:N/A:H,CVE-2026-23991,CWE-617; CWE-754,Go,github.com/theupdateframework/go-tuf/v2,0,2.3.1,2026-01-21T16:19:28Z,2026-01-22T15:43:38Z
GHSA-848j-6mx2-7j84,Elliptic Uses a Cryptographic Primitive with a Risky Implementation,LOW,CVSS:3.1/AV:N/AC:H/PR:N/UI:N/S:U/C:L/I:L/A:L,CVE-2025-14505,CWE-1240,npm,elliptic,0,,2026-01-08T21:30:34Z,2026-01-09T20:19:43Z
GHSA-8623-9fwr-4cxv,Quick-Media Batik Codec FIX package has Code Injection vulnerability,MODERATE,CVSS:4.0/AV:N/AC:L/AT:N/PR:N/UI:P/VC:N/VI:L/VA:L/SC:N/SI:N/SA:N/S:N/AU:Y/R:U/V:C/RE:M/U:Amber,CVE-2026-24806,CWE-94,Maven,com.github.liuyueyi.media:batik-codec-fix,0,,2026-01-27T09:30:30Z,2026-01-28T15:52:10Z
GHSA-86gh-c8r8-xwhq,phpPgAdmin contains a remote command execution vulnerability,HIGH,CVSS:3.1/AV:N/AC:L/PR:L/UI:N/S:U/C:H/I:H/A:H,CVE-2021-47853,CWE-78,Packagist,phppgadmin/phppgadmin,0,,2026-01-21T18:30:31Z,2026-02-02T20:33:47Z
GHSA-86rf-68f4-2cph,Duplicate Advisory: go-viper's mapstructure May Leak Sensitive Information in Logs When Processing Malformed Data,MODERATE,CVSS:3.1/AV:N/AC:H/PR:N/UI:R/S:U/C:H/I:N/A:N,,CWE-117,Go,github.com/go-viper/mapstructure/v2,0,2.4.0,2026-01-26T21:30:36Z,2026-01-27T21:00:31Z
GHSA-87hc-h4r5-73f7, Werkzeug safe_join() allows Windows special device names with compound extensions,MODERATE,CVSS:3.1/AV:N/AC:L/PR:N/UI:N/S:U/C:N/I:N/A:L,CVE-2026-21860,CWE-67,PyPI,Werkzeug,0,3.1.5,2026-01-08T19:51:21Z,2026-02-02T19:57:31Z
GHSA-88q6-jcjg-hvmw,jose-swift has JWT Signature Verification Bypass via None Algorithm,HIGH,CVSS:4.0/AV:N/AC:L/AT:N/PR:N/UI:N/VC:H/VI:H/VA:N/SC:N/SI:N/SA:N/E:P,,CWE-327,SwiftURL,github.com/beatt83/jose-swift,0,,2026-01-09T19:39:30Z,2026-01-09T19:39:30Z
GHSA-8c39-xppg-479c,Pterodactyl does not revoke SFTP access when server is deleted or permissions reduced,HIGH,CVSS:4.0/AV:N/AC:L/AT:P/PR:H/UI:N/VC:H/VI:H/VA:H/SC:N/SI:N/SA:N,CVE-2025-68954,CWE-613,Packagist,pterodactyl/panel,0,1.12.0,2026-01-06T17:18:56Z,2026-01-06T17:18:56Z
GHSA-8cw6-53m5-4932,StudioCMS has Authorization Bypass Through User-Controlled Key,MODERATE,CVSS:3.1/AV:N/AC:L/PR:L/UI:N/S:U/C:H/I:N/A:N,CVE-2026-24134,CWE-639; CWE-862,npm,studiocms,0,0.2.0,2026-01-27T22:13:52Z,2026-01-29T03:43:54Z
GHSA-8fwc-qjw5-rvgp,Gitea may send release notification emails for private repositories to users whose access has been revoked,LOW,CVSS:4.0/AV:N/AC:L/AT:P/PR:L/UI:N/VC:L/VI:N/VA:N/SC:N/SI:N/SA:N,CVE-2026-0798,CWE-284,Go,code.gitea.io/gitea,0,1.25.4,2026-01-23T00:31:16Z,2026-01-23T20:11:25Z
GHSA-8h3q-9fpp-c883,Duplicate Advisory: Wrangler affected by OS Command Injection in `wrangler pages deploy`,HIGH,CVSS:4.0/AV:N/AC:L/AT:P/PR:L/UI:N/VC:H/VI:H/VA:H/SC:L/SI:L/SA:N,,CWE-20,npm,wrangler,2.0.15,,2026-01-21T00:31:43Z,2026-01-29T03:38:35Z
GHSA-8hf7-h89p-3pqj,MobSF has Stored XSS via Manifest Analysis - Dialer Code Host Field,HIGH,CVSS:3.1/AV:N/AC:L/PR:H/UI:R/S:C/C:H/I:H/A:N,CVE-2026-24490,CWE-79,PyPI,mobsf,0,4.4.5,2026-01-26T23:36:19Z,2026-01-29T03:25:29Z
GHSA-8p9x-46gm-qfx2,Kyverno Cross-Namespace Privilege Escalation via Policy apiCall,CRITICAL,CVSS:3.1/AV:N/AC:L/PR:L/UI:N/S:C/C:H/I:H/A:H,CVE-2026-22039,CWE-269; CWE-918,Go,github.com/kyverno/kyverno,0,1.15.3,2026-01-27T18:01:26Z,2026-01-29T03:31:31Z
GHSA-8qq5-rm4j-mr97,node-tar is Vulnerable to Arbitrary File Overwrite and Symlink Poisoning via Insufficient Path Sanitization,HIGH,CVSS:4.0/AV:L/AC:L/AT:N/PR:N/UI:A/VC:H/VI:L/VA:N/SC:H/SI:L/SA:N,CVE-2026-23745,CWE-22,npm,tar,0,7.5.3,2026-01-16T21:16:20Z,2026-02-18T23:43:46Z
GHSA-8r9q-7v3j-jr4g,Anthropic's MCP TypeScript SDK has a ReDoS vulnerability,HIGH,CVSS:4.0/AV:N/AC:L/AT:N/PR:N/UI:N/VC:N/VI:N/VA:H/SC:N/SI:N/SA:N,CVE-2026-0621,CWE-1333,npm,@modelcontextprotocol/sdk,0,1.25.2,2026-01-05T21:30:33Z,2026-01-07T16:16:27Z
GHSA-8rgq-m2pm-jvmg,Duplicate Advisory: gix-date can create non-utf8 string with `TimeBuf::as_str`,MODERATE,CVSS:4.0/AV:L/AC:L/AT:N/PR:N/UI:N/VC:N/VI:H/VA:H/SC:N/SI:N/SA:N/E:P,,CWE-787,crates.io,gix-date,0,0.12.0,2026-01-26T21:30:36Z,2026-01-27T22:22:40Z
GHSA-8rrh-rw8j-w5fx,Wheel Affected by Arbitrary File Permission Modification via Path Traversal in wheel unpack,HIGH,CVSS:3.1/AV:L/AC:L/PR:N/UI:R/S:U/C:N/I:H/A:H,CVE-2026-24049,CWE-22,PyPI,wheel,0.40.0,0.46.2,2026-01-22T18:02:56Z,2026-01-23T17:44:38Z
GHSA-8v65-47jx-7mfr,Mailpit Proxy Endpoint has Server-Side Request Forgery (SSRF) vulnerability,MODERATE,CVSS:3.1/AV:N/AC:L/PR:N/UI:N/S:C/C:L/I:N/A:N,CVE-2026-21859,CWE-918,Go,github.com/axllent/mailpit,0,1.28.1,2026-01-06T17:44:29Z,2026-02-02T14:51:32Z
GHSA-8v8x-cx79-35w7,React Router SSR XSS in ScrollRestoration,HIGH,CVSS:3.1/AV:N/AC:L/PR:N/UI:R/S:C/C:H/I:L/A:N,CVE-2026-21884,CWE-79,npm,react-router,7.0.0,7.12.0,2026-01-08T20:50:05Z,2026-01-11T14:54:08Z
GHSA-8w7m-w749-rx98,"Pterodactyl websocket endpoints have no visible rate limits or monitoring, allowing for DOS attacks",HIGH,CVSS:3.1/AV:N/AC:L/PR:L/UI:N/S:U/C:N/I:N/A:H,CVE-2025-69199,CWE-400; CWE-770,Go,github.com/pterodactyl/wings,0,1.12.0,2026-01-20T16:30:40Z,2026-02-02T22:21:53Z
GHSA-923j-vrcg-hxwh,malcontent vulnerable to symlink Path Traversal via handleSymlink argument confusion in archive extraction,MODERATE,CVSS:3.1/AV:L/AC:L/PR:N/UI:R/S:U/C:N/I:H/A:N,CVE-2026-24846,CWE-22; CWE-683,Go,github.com/chainguard-dev/malcontent,1.8.0,1.20.3,2026-01-29T22:05:15Z,2026-01-31T03:33:39Z
GHSA-92cc-952p-v8rh,Apache Hadoop HDFS Native Client has Out-of-bounds Write Vulnerability ,HIGH,CVSS:3.1/AV:N/AC:L/PR:N/UI:N/S:U/C:L/I:L/A:L,CVE-2025-27821,CWE-787,Maven,org.apache.hadoop:hadoop-hdfs-native-client,3.2.0,3.4.2,2026-01-26T12:30:27Z,2026-01-26T23:40:20Z
GHSA-93jc-vqqc-vvvh,Signal K Server Vulnerable to Remote Code Execution via Malicious npm Package,HIGH,CVSS:3.1/AV:N/AC:L/PR:H/UI:N/S:U/C:H/I:H/A:H,CVE-2025-68619,CWE-94,npm,signalk-server,0,2.9.0,2026-01-02T15:23:39Z,2026-01-06T18:41:41Z
GHSA-94c7-g2fj-7682,SiYuan Vulnerable to Arbitrary File Read via File Copy Functionality,HIGH,CVSS:4.0/AV:N/AC:L/AT:N/PR:L/UI:N/VC:H/VI:N/VA:N/SC:H/SI:N/SA:N,CVE-2026-23851,CWE-22,Go,github.com/siyuan-note/siyuan/kernel,0,0.0.0-20260118092521-f8f4b517077b,2026-01-21T01:01:47Z,2026-01-21T01:01:47Z
GHSA-9583-h5hc-x8cw,React Router has Path Traversal in File Session Storage,CRITICAL,CVSS:3.1/AV:N/AC:L/PR:N/UI:N/S:U/C:N/I:H/A:H,CVE-2025-61686,CWE-22,npm,@react-router/node,7.0.0,7.9.4,2026-01-08T20:45:07Z,2026-01-11T14:53:54Z
GHSA-95c6-p277-p87g,FastAPI Api Key has a timing side-channel in verify_key that allows statistical key validity detection,LOW,CVSS:3.1/AV:N/AC:H/PR:N/UI:N/S:U/C:L/I:N/A:N,CVE-2026-23996,CWE-208,PyPI,fastapi-api-key,0,1.1.0,2026-01-21T22:27:39Z,2026-01-22T15:40:29Z
GHSA-95ff-46g6-6gw9,"NocoDB has Prototype Pollution in Connection Test Endpoint, Leading to DoS",MODERATE,CVSS:3.1/AV:N/AC:L/PR:H/UI:N/S:U/C:N/I:N/A:H,CVE-2026-24766,CWE-1321,npm,nocodb,0,0.301.0,2026-01-28T21:41:26Z,2026-01-28T21:41:26Z
GHSA-96qw-h329-v5rg,Shakapacker has environment variable leak via EnvironmentPlugin that exposes secrets to client-side bundles,HIGH,CVSS:3.1/AV:N/AC:L/PR:N/UI:N/S:U/C:H/I:N/A:N,,CWE-200,npm,shakapacker,0,9.5.0,2026-01-08T21:13:37Z,2026-01-08T21:13:37Z
GHSA-96xm-fv9w-pf3f,"soroban-sdk has overflow in Bytes::slice, Vec::slice, GenRange::gen_range for u64",MODERATE,CVSS:3.1/AV:N/AC:L/PR:N/UI:N/S:U/C:N/I:L/A:N,CVE-2026-24889,CWE-190,crates.io,soroban-sdk,25.0.0,25.0.2,2026-01-28T22:20:35Z,2026-01-29T03:56:38Z
GHSA-9726-w42j-3qjr,picklescan has Arbitrary file read using `io.FileIO` ,HIGH,CVSS:4.0/AV:N/AC:L/AT:N/PR:N/UI:N/VC:H/VI:H/VA:N/SC:N/SI:N/SA:N/E:P,,CWE-22; CWE-918,PyPI,picklescan,0,0.0.35,2026-01-08T17:25:35Z,2026-01-08T17:25:35Z
GHSA-983w-rhvv-gwmv,WeasyPrint has a Server-Side Request Forgery (SSRF) Protection Bypass via HTTP Redirect,HIGH,CVSS:3.1/AV:N/AC:L/PR:N/UI:N/S:U/C:H/I:N/A:N,CVE-2025-68616,CWE-601; CWE-918,PyPI,weasyprint,0,68.0,2026-01-20T16:29:53Z,2026-01-20T16:29:54Z
GHSA-99p7-6v5w-7xg8,vm2 has a Sandbox Escape,CRITICAL,CVSS:3.1/AV:N/AC:L/PR:N/UI:N/S:U/C:H/I:H/A:H,CVE-2026-22709,CWE-693; CWE-913; CWE-94,npm,vm2,0,3.10.2,2026-01-26T18:57:14Z,2026-01-29T03:22:51Z
GHSA-9c48-w39g-hm26,rsa crate has potential panic on a prime being equal to 1,LOW,CVSS:4.0/AV:N/AC:L/AT:N/PR:N/UI:N/VC:N/VI:N/VA:L/SC:N/SI:N/SA:N/E:U,CVE-2026-21895,CWE-703,crates.io,rsa,0,0.9.10,2026-01-06T18:14:08Z,2026-01-08T21:18:57Z
GHSA-9cgq-wp42-4rpq,Gitea does not properly verify authorization when canceling scheduled auto-merges via the web interface,MODERATE,CVSS:4.0/AV:N/AC:L/AT:N/PR:L/UI:N/VC:N/VI:N/VA:L/SC:N/SI:N/SA:N,CVE-2026-20888,CWE-284,Go,github.com/go-gitea/gitea,0,1.25.4,2026-01-23T00:31:16Z,2026-01-23T20:14:41Z
GHSA-9cvc-h2w8-phrp,AWS SDK for .NET V4 adopted defense in depth enhancement for region parameter value,LOW,CVSS:3.1/AV:N/AC:H/PR:N/UI:N/S:U/C:L/I:N/A:N,CVE-2026-22611,CWE-20,NuGet,AWSSDK.Core,4.0.0,4.0.3.3,2026-01-09T18:56:21Z,2026-01-11T14:56:00Z
