ID,Summary,Severity,CVSS_Score,CVE_Aliases,CWE_IDs,Ecosystem,Package_Name,Version_Introduced,Version_Fixed,Published,Modified
GHSA-4g2f-xcph-2335,ingress-nginx has Improper Check for Unusual or Exceptional Conditions,LOW,CVSS:3.1/AV:N/AC:H/PR:L/UI:N/S:U/C:L/I:N/A:N,CVE-2026-24513,CWE-754,Go,k8s.io/ingress-nginx,0,1.13.7,2026-02-04T00:30:29Z,2026-02-04T20:05:31Z
GHSA-4hc4-8599-xh2h,OpenSTAManager has a Time-Based Blind SQL Injection with Amplified Denial of Service,HIGH,CVSS:4.0/AV:N/AC:L/AT:N/PR:L/UI:N/VC:H/VI:H/VA:H/SC:N/SI:N/SA:N,CVE-2026-24417,CWE-89,Packagist,devcode-it/openstamanager,0,,2026-02-06T18:23:14Z,2026-02-10T01:17:19Z
GHSA-4hfh-fch3-5q7p,Leaf-kit html escaping does not work on characters that are part of extended grapheme cluster,MODERATE,CVSS:3.1/AV:N/AC:L/PR:N/UI:R/S:C/C:L/I:L/A:N,CVE-2026-27120,CWE-75; CWE-79; CWE-87,SwiftURL,leaf-kit,0,1.4.1,2026-02-19T19:40:08Z,2026-02-23T22:21:47Z
GHSA-4hg8-92x6-h2f3,OpenClaw is Missing Webhook Authentication in Telnyx Provider Allows Unauthenticated Requests,HIGH,CVSS:3.1/AV:N/AC:L/PR:N/UI:N/S:U/C:N/I:H/A:N,CVE-2026-26319,CWE-306,npm,openclaw,0,2026.2.14,2026-02-17T21:40:46Z,2026-02-20T16:44:19Z
GHSA-4j2x-jh4m-fqv6,OpenSTAManager has a SQL Injection in the Prima Nota  module ,HIGH,CVSS:4.0/AV:N/AC:L/AT:N/PR:L/UI:N/VC:H/VI:H/VA:H/SC:N/SI:N/SA:N,CVE-2026-24419,CWE-89,Packagist,devcode-it/openstamanager,0,,2026-02-06T18:25:55Z,2026-02-10T01:17:32Z
GHSA-4j3g-rwwq-4p54,Neo4j Enterprise and Community vulnerable to a potential information disclosure,MODERATE,CVSS:4.0/AV:L/AC:L/AT:N/PR:L/UI:N/VC:L/VI:N/VA:N/SC:N/SI:N/SA:N,CVE-2026-1622,CWE-532,Maven,org.neo4j:neo4j,0,5.26.21,2026-02-04T12:31:25Z,2026-02-04T20:28:55Z
GHSA-4jqp-9qjv-57m2,Keylime Missing Authentication for Critical Function and Improper Authentication,CRITICAL,CVSS:3.1/AV:N/AC:L/PR:N/UI:N/S:U/C:L/I:H/A:H,CVE-2026-1709,CWE-295; CWE-306,PyPI,keylime,7.12.0,7.12.2,2026-02-06T22:34:44Z,2026-02-06T22:34:44Z
GHSA-4jvr-vj2c-8q37,EVE Seals Vault Key With SHA1 PCRs,MODERATE,CVSS:3.1/AV:P/AC:H/PR:L/UI:N/S:C/C:H/I:H/A:N,CVE-2023-43635,CWE-327; CWE-328; CWE-522,Go,github.com/lf-edge/eve,0,0.0.0-20230519072751-977f42b07fa9,2026-02-04T23:12:29Z,2026-02-04T23:12:29Z
GHSA-4mh3-h929-w968,File Browser has a Path-Based Access Control Bypass via Multiple Leading Slashes in URL,HIGH,CVSS:3.1/AV:N/AC:L/PR:L/UI:N/S:U/C:H/I:H/A:N,CVE-2026-25890,CWE-706; CWE-863,Go,github.com/filebrowser/filebrowser/v2,0,2.57.1,2026-02-10T00:25:17Z,2026-02-10T02:56:37Z
GHSA-4q3h-vp4r-prv2,Parse Server: Account takeover via JWT algorithm confusion in Google auth adapter,CRITICAL,CVSS:4.0/AV:N/AC:L/AT:N/PR:N/UI:N/VC:H/VI:H/VA:N/SC:N/SI:N/SA:N,CVE-2026-27804,CWE-327; CWE-345,npm,parse-server,9.0.0,9.3.1-alpha.4,2026-02-25T23:00:49Z,2026-02-27T21:52:22Z
GHSA-4q92-rfm6-2cqx,Claude Code has Permission Deny Bypass Through Symbolic Links,LOW,CVSS:4.0/AV:N/AC:L/AT:P/PR:N/UI:P/VC:L/VI:L/VA:L/SC:N/SI:N/SA:N,CVE-2026-25724,CWE-285; CWE-61,npm,@anthropic-ai/claude-code,0,2.1.7,2026-02-06T19:08:04Z,2026-02-06T19:08:04Z
GHSA-4qgr-4h56-8895,Vikunja has Reflected HTML Injection via filter Parameter in its Projects Module,MODERATE,CVSS:3.1/AV:N/AC:L/PR:N/UI:R/S:C/C:L/I:L/A:N,CVE-2026-27116,CWE-116; CWE-79; CWE-80,Go,code.vikunja.io/api,0,,2026-02-25T22:01:25Z,2026-02-27T21:50:55Z
GHSA-4qvv-g3vr-m348,Wagtail has improper permission handling on admin preview endpoints,MODERATE,CVSS:4.0/AV:N/AC:L/AT:N/PR:H/UI:N/VC:L/VI:N/VA:N/SC:N/SI:N/SA:N,CVE-2026-25517,CWE-862,PyPI,wagtail,0,6.3.6,2026-02-03T18:35:52Z,2026-02-04T21:58:34Z
GHSA-4r2x-xpjr-7cvv,vLLM has RCE In Video Processing,CRITICAL,CVSS:3.1/AV:N/AC:L/PR:N/UI:N/S:U/C:H/I:H/A:H,CVE-2026-22778,CWE-122; CWE-532,PyPI,vllm,0.8.3,0.14.1,2026-02-02T17:43:45Z,2026-02-03T16:12:12Z
GHSA-4r4r-4jp4-wwf9,FUXA has JWT Authentication Bypass via HTTP Referer header spoofing,CRITICAL,CVSS:3.1/AV:N/AC:L/PR:N/UI:N/S:U/C:H/I:H/A:H,CVE-2025-69985,CWE-288,npm,@frangoteam/fuxa,0,,2026-02-24T18:31:02Z,2026-02-26T15:45:40Z
GHSA-4rj2-gpmh-qq5x,OpenClaw has an inbound allowlist policy bypass in voice-call extension (empty caller ID + suffix matching),CRITICAL,CVSS:3.1/AV:N/AC:L/PR:N/UI:N/S:U/C:H/I:H/A:L,CVE-2026-28446,CWE-287,npm,openclaw,0,2026.2.2,2026-02-17T21:36:34Z,2026-03-10T22:21:59Z
GHSA-4rrr-2h4v-f3j9,Django has Inefficient Algorithmic Complexity,LOW,CVSS:4.0/AV:N/AC:L/AT:N/PR:N/UI:N/VC:N/VI:N/VA:L/SC:N/SI:N/SA:N/E:U,CVE-2026-1285,CWE-407,PyPI,Django,6.0a1,6.0.2,2026-02-03T15:30:23Z,2026-02-03T19:31:15Z
GHSA-4rv8-5cmm-2r22,osctrl has Stored Cross-Site Scripting (XSS) in On-Demand Query List,MODERATE,CVSS:3.1/AV:N/AC:L/PR:H/UI:R/S:U/C:H/I:H/A:N,CVE-2026-28280,CWE-79,Go,github.com/jmpsec/osctrl,0,0.5.0,2026-02-28T02:07:15Z,2026-03-02T15:22:41Z
GHSA-4v7v-7v7r-3r5h,"FacturaScripts has Stored Cross-Site Scripting (XSS) in ""Observations"" field via History View",HIGH,CVSS:3.1/AV:N/AC:L/PR:L/UI:R/S:U/C:H/I:H/A:H,CVE-2026-23997,CWE-79,Packagist,facturascripts/facturascripts,0,,2026-02-02T18:17:33Z,2026-02-03T16:12:21Z
GHSA-4wwf-f7w3-94f5,RaspAP raspap-webgui contains an OS Command Injection vulnerability,HIGH,CVSS:3.0/AV:N/AC:L/PR:L/UI:N/S:U/C:H/I:H/A:H,CVE-2026-24788,CWE-78,Packagist,billz/raspap-webgui,0,3.3.6,2026-02-02T06:30:52Z,2026-02-02T20:53:03Z
GHSA-4x5p-f36r-mxxr,mlflow Creates of Temporary File in Directory with Insecure Permissions,HIGH,CVSS:3.0/AV:L/AC:H/PR:L/UI:N/S:U/C:H/I:H/A:H,CVE-2025-10279,CWE-379,PyPI,mlflow,0,3.4.0rc0,2026-02-02T12:31:14Z,2026-02-02T21:57:58Z
GHSA-4xrr-hq4w-6vf4,Caddy: Improper sanitization of glob characters in file matcher may lead to bypassing security protections,MODERATE,CVSS:4.0/AV:N/AC:L/AT:P/PR:N/UI:N/VC:N/VI:H/VA:N/SC:N/SI:N/SA:N/E:P,CVE-2026-27585,CWE-20,Go,github.com/caddyserver/caddy/v2,0,2.11.1,2026-02-24T20:16:55Z,2026-02-27T19:51:57Z
GHSA-4xwv-49c8-fvhq,OpenSTAManager has a SQL Injection vulnerability in the Scadenzario bulk operations module,HIGH,CVSS:4.0/AV:N/AC:L/AT:N/PR:L/UI:N/VC:H/VI:H/VA:H/SC:N/SI:N/SA:N,CVE-2026-24418,CWE-89,Packagist,devcode-it/openstamanager,0,,2026-02-06T18:24:10Z,2026-02-10T01:17:51Z
GHSA-543g-8grm-9cw6,"ImageMagick has Division-by-Zero in YUV sampling factor validation, which leads to crash",MODERATE,CVSS:3.1/AV:N/AC:L/PR:N/UI:N/S:U/C:N/I:N/A:L,CVE-2026-25799,CWE-369,NuGet,Magick.NET-Q16-AnyCPU,0,14.10.3,2026-02-24T15:37:53Z,2026-02-24T15:37:53Z
GHSA-5476-xc4j-rqcv,c3p0 vulnerable to Remote Code Execution via unsafe deserialization of userOverridesAsString property,HIGH,CVSS:4.0/AV:A/AC:L/AT:P/PR:L/UI:N/VC:H/VI:H/VA:H/SC:H/SI:H/SA:H,CVE-2026-27830,CWE-502; CWE-94,Maven,com.mchange:c3p0,0,0.12.0,2026-02-25T18:35:23Z,2026-02-27T21:53:39Z
GHSA-56f2-hvwg-5743,OpenClaw affected by SSRF in Image Tool Remote Fetch,HIGH,CVSS:3.1/AV:N/AC:L/PR:L/UI:N/S:U/C:H/I:L/A:L,,CWE-918,npm,openclaw,0,2026.2.2,2026-02-17T17:13:35Z,2026-02-17T17:13:35Z
GHSA-57cc-2pf4-mhmx,Mattermost fails to properly validate team membership when processing channel mentions,MODERATE,CVSS:3.1/AV:N/AC:L/PR:L/UI:N/S:U/C:L/I:N/A:N,CVE-2025-14350,CWE-862,Go,github.com/mattermost/mattermost/server/v8,0,8.0.0-20251209134645-761e56bb11cc,2026-02-16T15:32:47Z,2026-02-19T19:35:24Z
GHSA-58jh-xv4v-pcx4,@nyariv/sandboxjs has a Sandbox Escape issue,CRITICAL,CVSS:3.1/AV:N/AC:L/PR:N/UI:N/S:C/C:H/I:H/A:H,CVE-2026-25520,CWE-74,npm,@nyariv/sandboxjs,0,0.8.29,2026-02-05T20:41:28Z,2026-02-06T21:42:23Z
GHSA-5c6j-r48x-rmvq,Serialize JavaScript is Vulnerable to RCE via RegExp.flags and Date.prototype.toISOString(),HIGH,CVSS:3.1/AV:N/AC:H/PR:N/UI:N/S:U/C:H/I:H/A:H,,CWE-96,npm,serialize-javascript,0,7.0.3,2026-02-28T02:50:45Z,2026-03-02T16:17:35Z
GHSA-5cx4-w4fh-fr57,Moodle Affected by Improper Restriction of Excessive Authentication Attempts,HIGH,CVSS:3.1/AV:N/AC:L/PR:N/UI:N/S:U/C:H/I:N/A:N,CVE-2025-67853,CWE-307,Packagist,moodle/moodle,0,4.1.22,2026-02-03T12:30:29Z,2026-02-03T19:15:22Z
GHSA-5g2w-9f8g-g5q7,Apache Airflow UI Exposes DAG Import Errors to Unauthorized Authenticated Users,MODERATE,CVSS:3.1/AV:N/AC:L/PR:L/UI:N/S:U/C:H/I:N/A:N,CVE-2026-24098,CWE-200,PyPI,apache-airflow,0,3.1.7,2026-02-09T12:30:22Z,2026-02-11T21:39:40Z
GHSA-5g94-c2wx-8pxw,apko has a path traversal in apko dirFS which allows filesystem writes outside base,HIGH,CVSS:3.1/AV:N/AC:L/PR:N/UI:N/S:U/C:N/I:H/A:N,CVE-2026-25121,CWE-22; CWE-23,Go,chainguard.dev/apko,0.14.8,1.1.0,2026-02-03T23:57:48Z,2026-02-04T21:55:44Z
GHSA-5h7v-g49c-h887,EVE Doesn't Protect Rootfs,MODERATE,CVSS:3.1/AV:P/AC:H/PR:L/UI:N/S:C/C:H/I:H/A:N,CVE-2023-43636,CWE-345,Go,github.com/lf-edge/eve/pkg/grub,0,0.0.0-20220708121648-5fef4d92e758,2026-02-04T23:14:42Z,2026-02-04T23:14:42Z
GHSA-5jg5-xqfw-rv92,Microweber has a Cross-site Scripting vulnerability,LOW,CVSS:3.1/AV:N/AC:L/PR:N/UI:R/S:C/C:L/I:L/A:N,CVE-2025-70791,CWE-79,Packagist,microweber/microweber,0,2.0.20,2026-02-05T18:30:32Z,2026-02-05T21:50:26Z
GHSA-5jvp-m9h4-253h,Fleet: Authorization Bypass in certificate template batch deletion for team administrators,MODERATE,CVSS:4.0/AV:N/AC:L/AT:N/PR:L/UI:N/VC:N/VI:H/VA:L/SC:N/SI:N/SA:N/E:U,CVE-2026-25963,CWE-863,Go,github.com/fleetdm/fleet/v4,0,4.80.1,2026-02-26T19:40:10Z,2026-02-26T19:40:10Z
GHSA-5m2g-4cf6-c3rg,funadmin has Incorrect Privilege Assignment in its Configuration Handler,MODERATE,CVSS:3.1/AV:N/AC:L/PR:N/UI:N/S:U/C:L/I:L/A:L,CVE-2026-2896,CWE-266,Packagist,funadmin/funadmin,0,,2026-02-22T00:31:01Z,2026-02-26T15:31:55Z
GHSA-5mx2-w598-339m,RediSearch Query Injection in @langchain/langgraph-checkpoint-redis,MODERATE,CVSS:3.1/AV:N/AC:L/PR:L/UI:N/S:U/C:H/I:N/A:N,CVE-2026-27022,CWE-74,npm,@langchain/langgraph-checkpoint-redis,0,1.0.2,2026-02-18T22:40:09Z,2026-02-23T22:20:29Z
GHSA-5pqf-54qp-32wx,LibreNMS /device-groups name Stored Cross-Site Scripting,MODERATE,CVSS:4.0/AV:N/AC:L/AT:N/PR:L/UI:P/VC:L/VI:L/VA:N/SC:L/SI:L/SA:N,CVE-2026-26991,CWE-79,Packagist,librenms/librenms,0,26.2.0,2026-02-18T22:07:19Z,2026-02-20T16:51:51Z
GHSA-5qhx-gwfj-6jqr, Gogs user can update repository content with read-only permission,MODERATE,CVSS:3.1/AV:N/AC:L/PR:L/UI:N/S:U/C:N/I:H/A:N,CVE-2026-23632,CWE-862; CWE-863,Go,gogs.io/gogs,0,0.13.4,2026-02-06T18:10:05Z,2026-02-06T19:06:54Z
GHSA-5r23-prx4-mqg3,"Cilium may not enforce host firewall policies when Native Routing, WireGuard and Node Encryption are enabled",MODERATE,CVSS:3.1/AV:A/AC:L/PR:N/UI:N/S:C/C:L/I:L/A:N,CVE-2026-26963,CWE-863,Go,github.com/cilium/cilium,1.18.0,1.18.6,2026-02-19T19:39:01Z,2026-02-20T16:46:49Z
GHSA-5r3v-vc8m-m96g,Caddy: Unicode case-folding length expansion causes incorrect split_path index in FastCGI transport,HIGH,CVSS:4.0/AV:N/AC:L/AT:N/PR:N/UI:N/VC:H/VI:H/VA:H/SC:N/SI:N/SA:N/E:P,CVE-2026-27590,CWE-20,Go,github.com/caddyserver/caddy/v2,0,2.11.1,2026-02-24T20:39:08Z,2026-02-27T19:55:10Z
GHSA-5r63-q8hg-p8qx,FUXA allows Remote Code Execution (RCE) via the project import functionality.,HIGH,CVSS:3.1/AV:N/AC:L/PR:N/UI:N/S:U/C:H/I:H/A:H,CVE-2025-69983,CWE-78; CWE-94,npm,fuxa-server,0,,2026-02-03T18:30:47Z,2026-02-11T18:40:08Z
GHSA-5rc7-2jj6-mp64,Terraform Provider  for Linode Debug Logs Vulnerable to Sensitive Information Exposure,MODERATE,CVSS:3.1/AV:N/AC:L/PR:L/UI:N/S:C/C:L/I:N/A:N,CVE-2026-27900,CWE-532,Go,github.com/linode/terraform-provider-linode/v3,0,3.9.0,2026-02-26T20:00:12Z,2026-02-26T20:00:12Z
GHSA-5rmx-256w-8mj9,WireGuard Portal is Vulnerable to Privilege Escalation via User Self-Update to Admin Level,HIGH,CVSS:3.1/AV:N/AC:L/PR:L/UI:N/S:U/C:H/I:H/A:H,CVE-2026-27899,CWE-269; CWE-863,Go,github.com/h44z/wg-portal,0,2.1.3,2026-02-26T22:22:23Z,2026-02-26T22:22:23Z
GHSA-5rq4-664w-9x2c,Basic FTP has Path Traversal Vulnerability in its downloadToDir() method,CRITICAL,CVSS:3.1/AV:N/AC:L/PR:N/UI:N/S:U/C:N/I:H/A:H,CVE-2026-27699,CWE-22,npm,basic-ftp,0,5.2.0,2026-02-25T22:34:26Z,2026-02-25T22:34:26Z
GHSA-5vv4-hvf7-2h46,Command Injection via Unsanitized `locate` Output in `versions()` — systeminformation,HIGH,CVSS:3.1/AV:L/AC:L/PR:L/UI:N/S:C/C:H/I:H/A:H,CVE-2026-26318,CWE-78,npm,systeminformation,0,5.31.0,2026-02-18T22:36:50Z,2026-02-19T21:57:18Z
GHSA-5vvm-67pj-72g4,Kargo has Missing Authorization Vulnerabilities in Approval & Promotion REST API Endpoints,MODERATE,CVSS:4.0/AV:N/AC:L/AT:N/PR:L/UI:N/VC:N/VI:L/VA:N/SC:N/SI:L/SA:N,CVE-2026-27111,CWE-862,Go,github.com/akuity/kargo,1.9.0,1.9.3,2026-02-19T15:16:31Z,2026-02-23T22:21:12Z
GHSA-5w5r-8xc6-2xhw,Apache Answer Exposure of Private Personal Information to an Unauthorized Actor vulnerability,MODERATE,CVSS:3.1/AV:N/AC:L/PR:N/UI:N/S:U/C:H/I:N/A:N,CVE-2026-24735,CWE-359,Go,github.com/apache/answer,0,2.0.0,2026-02-04T12:31:25Z,2026-02-04T21:57:33Z